lengua y traducctor,id_título,título,anio primer edición,editorial1b 1,editorial1b 2,editorial1b 3,editorial1b 4,editorial1b 5,editorial1b 6,editorial2b,ciudad_ed,país_ed,lengua o idioma,género,género2
Traducción al francés de : Céline Zins.,213734,Des orchidées au clair de lune,1984,Gallimard,,,,,,,París,Francia,Francés,Dramaturgia,
Edición y compilación de: Jorge F. Hernández.,213758,"Sun, Stone, and Shadows : 20 Great Mexican Short Stories",2008,Fondo de Cultura Económica,,,,,,,D.F.,México,Inglés,Narrativa,Cuento
Traducción al holandés de: Mieke Westra.,213773,Aura,1991,Meulenhoff,,,,,,,Ámsterdam,Países Bajos,Holandés,Narrativa,Novela
Traducción de: Cornelia Radulescu.,213782,Instinctul lui Inez,2002,Humanitas,,,,,,,Bucarest,,Rumano,Narrativa,Novela
Traducción al francés de: Roger Munier.,213786,Point de convergence,2013,Gallimard,,,,,,Essais,París,Francia,Francés,Crítica y estudios sobre géneros varios,
Traducción al francés de : Ève- Marie . Traducción al francés de : Claude Fell.,213788,"Le sourire d'Erasme: épopée, utopie et mythe dans le roman hispano-américain",1992,Gallimard,,,,,,Le messager,París,Francia,Francés,Ensayo,
Traducción al francés de : Philippe Eustachon.,213802,Belize,2014,Éditions Le Miroir qui fume,,,,,,Théâtre Contemporain,X,Francia,Francés,Dramaturgia,
Traducción al francés de: Sophie Gewinner.,213805,Moctezuma II,2010,Éditions Le Miroir qui fume,,,,,,Théâtre mexican du XXe siècle,X,Francia,Francés,Dramaturgia,
Traducción al francés de: Adeline Isabel-Mignot. Traducción al francés de: Olivier Mouginot.,213807,Heures de nuit,2012,Éditions Le Miroir qui fume,,,,,,Théâtre Contemporain,X,Francia,Francés,Dramaturgia,
Traducción al francés de: Christilla Vasserot. Prefacio de: Daniel Meyran.,213809,Molière,2005,Éditions Le Miroir qui fume,,,,,,Théâtre Contemporain,X,Francia,Francés,Dramaturgia,
Traducción al francés de: Svetlana Doubin.,213812,Bienvenue dans le nouveau siècle Doktor Freud,2009,Éditions Le Miroir qui fume,,,,,,Théâtre Contemporain,X,Francia,Francés,Dramaturgia,
,213814,Phèdre et autres grecques,2004,Éditions Le Miroir qui fume,,,,,,Théâtre Contemporain,X,Francia,Francés,Dramaturgia,
Traducción al inglés de: Elizabeth Plaister.,213815,Palinuro of Mexico,1989,Quartet Books,,,,,,,Londres,Reino Unido,Inglés,Narrativa,Novela
Traducción al francés de: Rauda Jamis.,213816,"Cher Diego, Quiela t'embrasse",1993,Actes Sud,,,,,,,Arles,Francia,Francés,Narrativa,Novela
Traducción al francés de: Rauda Jamis.,213817,La fille du philosophe,1989,Actes Sud,,,,,,,Arles,Francia,Francés,Narrativa,Novela
Traducción al inglés de: David Dorado Romo.,213818,Las soldaderas : women of the Mexican Revolution,2006,Cinco Puntos Press,,,,,,,El Paso,EUA,Inglés,"Ensayo, Crítica y estudios sobre géneros varios",
Traducción al inglés de: Katherine Silver. Traducción al inglés de: Katherine Silver.,213819,Tinisima,1996,Faber,,,,,,,Londres,Reino Unido,Inglés,Narrativa,Novela
Traducción al inglés de: Deanna Heikkinen.,213821,The skin of the sky,2006,University of New Mexico Press,,,,,,,Albuquerque,EUA,Inglés,Narrativa,Novela
Traducción al inglés y prólogo de: Elizabeth Coonrod Martínez.,213844,Lilus Kikus and other stories,2005,University of New Mexico Press,,,,,,,Albuquerque,EUA,Inglés,Narrativa,Novela
Traducción al inglés de: Helen Lane.,213845,Massacre in Mexico,1975,The Viking Press,,,,,,,Nueva York,EUA,Inglés,Narrativa,Crónica
Traducción al francés de: Jean-Claude Masson.,213849,Itinéraire,1996,Gallimard,,,,,,Arcades,París,Francia,Francés,Obras biográficas,"Biografías, autobiografías y memorias"
Traducción al francés de: Jean-Claude Masson.,213852,Un au-delà érotique: le marquis de Sade,1994,Gallimard,,,,,,Arcades,París,Francia,Francés,Crítica y estudios sobre géneros varios,
Traducción al francés de: Claude Esteban.,213854,La flamme double. Amour et érotisme,1994,Gallimard,,,,,,Du monde entier,París,Francia,Francés,Crítica y estudios sobre géneros varios,
Traducción al francés de: Robert Marrast.,213855,Conjonctions et disjonctions,1990,Gallimard,,,,,,Essais,París,Francia,Francés,Crítica y estudios sobre géneros varios,
Traducción al finés de: Roger Munier.,213857,Courant alternatif,1990,Gallimard,,,,,,Essais,París,Francia,Francés,Crítica y estudios sobre géneros varios,
Traducción al francés de: Florence Delay. Traducción al francés de: Frédéric Magne. Traducción al francés de: Jacques Roubaud.,213861,Le divin Narcisse précedé de Premier songe et autres textes,1987,Gallimard,,,,,,,París,Francia,Francés,Poesía,
Traducción al francés de: Marie-Amélie Sarrailh.,213864,La foire,1968,Gallimard,,,,,,La croix du Sud,París,Francia,Francés,Narrativa,Crónica
Traducción al francés de: Annette Andro.,213865,Le Christ des ténèbres,1994,Gallimard,,,,,,,París,Francia,Francés,Narrativa,Novela
Traducción al danés de: Iben Hasselbach.,213871,Inez,2002,Lindhardt og Ringhof,,,,,,,X,Dinamarca,Danés,Narrativa,Novela
traducción al polaco de: Zofia Wasitowa.,213874,Instynkt pieknej Inez,2002,Grupa Wydawnicza Bertelsmann Media LiBROS,,,,,,,Varsovia,Polonia,Polaco,Narrativa,Novela
Traducción al turco de: Pinar Savas.,213878,Inez'in Sezgisi,2003,Can Yayinlari,,,,,,,Estambul,Turquía,Turco,Narrativa,Novela
Traducción al Otomí de: Margarita de la Vega Lázaro. Ilustración de: Irma Bastida Herrera.,213880,Machincuepa,2008,Fondo Editorial Estado de México,,,,,,Lectores Niños y Jóvenes / Secretaría de Educación del Estado de México,Toluca,México,otomí,,
Traducción al matlatzinca de: Leonardo Carranza Martínez. Ilustración de: Irma Bastida Herrera.,213881,Machincuepa,2008,Fondo Editorial Estado de México,,,,,,Lectores Niños y Jóvenes / Secretaría de Educación del Estado de México,Toluca,México,matlatzinca,Poesía,
Traducción al mazahua de: Joel Martínez Álvarez. Ilustración de: Irma Bastida Herrera.,213882,Machincuepa,2008,Fondo Editorial Estado de México,,,,,,Lectores Niños y Jóvenes / Secretaría de Educación del Estado de México,Toluca,México,mazahua,Poesía,
Traducción al francés de: Boris Schoemann.,213891,Le ciel dans la peau,2008,Éditions Le Miroir qui fume,,,,,,Théâtre Contemporain; 7,X,Francia,Francés,Dramaturgia,
Traducción al francés de: Elena de la Souchère.,213892,Les premiers mexicains. La vie créole au XVIe siècle,1969,Gallimard,,,,,,La croix du Sud,París,Francia,Francés,Ensayo,
Traducción al francés de: Laura Alcoba.,213895,Signes qui précéderont la fin du monde,2014,Gallimard,,,,,,Du monde entier,París,Francia,Francés,Narrativa,Novela
Traducción al francés de: Laura Alcoba.,213897,Les travaux du royaume,2012,Gallimard,,,,,,Du monde entier,París,Francia,Francés,Narrativa,Novela
Traducción al francés de: Juliette Ponce.,213898,L'affaire tequila. Une enquête de Sunny Pascal.,2014,Gallimard,,,,,,Folio policier,París,Francia,Francés,Narrativa,Novela
Traducción al francés de: Juliette Ponce.,213901,Martini shoot. Une enquête de Sunny Pascal,2013,Gallimard,,,,,,Folio policier,París,Francia,Francés,Narrativa,Novela
Traducción al francés de: Eugène Frédéric Illouz.,213904,Vif comme le désir,2013,Gallimard,,,,,,Folio,París,Francia,Francés,Narrativa,Novela
Traducción al francés de: Eduardo Jiménez Mayo. Traducción al francés de: Jacques Rémy-Zéphir.,213906,"Chocolat amer. Roman-feuilleton où l'on trouvera des recettes, des histoires d'amour et des remèdes de bonne femme.",2009,Gallimard,,,,,,Folio,París,Francia,Francés,Narrativa,Novela
Traducción al francés de: Eduardo Jiménez Mayo.,213909,Hypothermie,2012,Gallimard,,,,,,Du monde entier,París,Francia,Francés,Narrativa,Novela
Traducción al inglés de: David Jhonston.,213910,On insomnia and midnight,2006,Oberon Books LTD,,,,,,,Londres,Reino Unido,Inglés,Dramaturgia,
Traducción al francés de: Gabriel Iaculli.,213911,Mezquite Road,2012,Gallimard,,,,,,Folio policier,París,Francia,Francés,Narrativa,Novela
,213912,The Labyrinth of Solitude,2005,Penguin Random House,,,,,,,,,Inglés,Ensayo,
Traducción al francés de: Gabriel Iaculli.,213913,Tijuana City Blues,2010,Gallimard,,,,,,Folio policier,París,Francia,Francés,Narrativa,Novela
Traducción al francés de: Jean-Luc Lacarrière.,213916,Cahier du nomade. Choix de poèmes 1946-1997,2009,Gallimard,,,,,,Poésie/Gallimard,París,Francia,Francés,Poesía,
Traducción al francés de: Gabriel Iaculli.,213918,La vie conjugale,2009,Gallimard,,,,,,Folio,París,Francia,Francés,Narrativa,Novela
Traducción al francés de: Serge Mestre.,213921,Edén,2009,Gallimard,,,,,,Du monde entier,París,Francia,Francés,Narrativa,Novela
Traducción al francés de: Vincent Raynaud.,213935,Vies perpendiculaires,2009,Gallimard,,,,,,Du monde entier,París,Francia,Francés,Narrativa,Novela
Traducción al francés de: Svetlana Doubin.,213936,Spirale d'artillerie,2007,Gallimard,,,,,,Du monde entier,París,Francia,Francés,Narrativa,Novela
Traducción al francés de: Albert Bensoussan.,213937,Amphitryon,2001,Gallimard,,,,,,Du monde entier,París,Francia,Francés,Narrativa,Novela
Traducción al francés de: Serge Mestre.,213939,Un café avec Gorrondona,2001,Gallimard,,,,,,Arcades,París,Francia,Francés,Narrativa,Novela
Traducción al francés de: Gabriel Iaculli.,213941,Mater la divine garce,2004,Gallimard,,,,,,Du monde entier,París,Francia,Francés,Narrativa,Novela
Traducción al francés de: Alain Hocquenghem.,213942,Une place en enfer,2004,Gallimard,,,,,,Série noire,París,Francia,Francés,Narrativa,Novela
Traducción al francés de: Aline Schulman.,213943,Survivent les mots. Poèmes 1986-1999,2003,Gallimard,,,,,,,París,Francia,Francés,Poesía,
Traducción al francés de: Céline Zins.,213944,Portraits dans le temps,2001,Gallimard,,,,,,,París,Francia,Francés,Poesía,
Traducción al francés de: Anny Amberni.,213945,Guerre au paradis,1999,Gallimard,,,,,,Du monde entier,París,Francia,Francés,Narrativa,Novela
Traducción de: Maria Bamberg. Traducción de: Ulrich Kunzmann. Traducción de: Veronika Schmidt. Traducción de: Christa Wegen. Traducción de: Lisa Grüneisen.,213967,Die fünf Sonnen Mexicos: ein Lesebuch für das 21. Jahrhundert,2010,Fischer,,,,,,,Fráncfort del Meno,Alemania,Alemán,Narrativa,Novela
Traducción de: Uffe Harder.,213970,Kristoffer Ufødt,1991,Gyldendal,,,,,,,Conpenague,,Danés,Narrativa,Novela
Traducción al portugués de: Celso Mauro Paciornik.,213996,À sombra da revolução mexicana,2000,EDUSP,,,,,,,São Paulo,Brasil,Portugués,Ensayo,
Traducción al portugués de: Paulo Cesar Thomaz.,213998,A outra mão de Lepanto,2006,Palindromo,,,,,,,X,Brasil,Portugués,Narrativa,Novela
Introducción de: Álvaro Enrigue. Traducción al inglés de: George Henson.,214000,The journey,2015,Deep Vellum,,,,,,,Dallas,EUA,Inglés,Narrativa,Crónica
Traducción al inglés de: George Henson.,214002,The art of flight,2015,Deep Vellum,,,,,,,Dallas,EUA,Inglés,Títulos de géneros varios,
Traducción al francés de: Jean-Claude Masson.,214008,Le temps des anges,1997,Gallimard,,,,,,Du monde entier,París,Francia,Francés,Poesía,
Traducción al francés de: Christilla Vasserot.,214010,La zone du silence,2005,Gallimard,,,,,,Bibliothèque étrangère,París,Francia,Francés,Narrativa,Novela
Traducción al francés de: Irma Sayol.,214014,Perséphone,1970,Gallimard,,,,,,Du monde entier,París,Francia,Francés,Poesía,
Traducción al francés de: Ivan Alechine.,214016,Les poèmes solaires précédé de Le poète en voie d'extinction et suivi de Baleine grise,2009,Gallimard,,,,,,Poésie/Gallimard,París,Francia,Francés,Poesía,
Traducción al francés de: Georges Pillement.,214018,L'ombre du Caudillo,1996,Gallimard,,,,,,Folio,París,Francia,Francés,Narrativa,Novela
Traducción al francés de: Martine Breuer.,214019,Les jeux sont faits,2004,Passage du Nord-Ouest,,,,,,,Albi,Francia,Francés,Narrativa,Cuento
Traducción al francés de: Juliette Ponce.,214021,Mariachi,2009,Gallimard,,,,,,Denoël & d'ailleurs,París,Francia,Francés,Narrativa,Cuento
Traducción al francés de: Jean-Francis Reille. Prefacio de: Antonio Castro Leal.,214022,L'aigle et le serpent,1967,Gallimard,,,,,,La croix du Sud,París,Francia,Francés,Narrativa,Novela
Traducción al francés de: Martine Breuer.,214023,L'art de la fugue,2005,Passage du Nord-Ouest,,,,,,,Albi,Francia,Francés,Títulos de géneros varios,
Traducción al francés de: Dominique Fischer.,214024,Les mortes,1996,Gallimard,,,,,,Série noire,París,Francia,Francés,Narrativa,Novela
Traducción al francés de: Anny Amberni.,214054,Popol wuh. Le livre des événements,1990,Gallimard,,,,,,L'aube des peuples,París,Francia,Francés,Narrativa,
Traducción al francés de: Michel Bibard.,214057,L'histoire très ordinaire de la générale Ascencio,1989,Gallimard,,,,,,Du monde entier,París,Francia,Francés,Narrativa,Novela
Traducción al francés de: Janine Castan.,214058,Le deuil humain,1987,Gallimard,,,,,,Du monde entier,París,Francia,Francés,Narrativa,Novela
Traducción al francés de: Michel Sarre.,214061,Vie de Jésusa,1980,Gallimard,,,,,,Du monde entier,París,Francia,Francés,Narrativa,Novela
Traducción al francés de: René L.-F. Durand.,214063,L'Hypogée secret,1971,Gallimard,,,,,,Du monde entier,París,Francia,Francés,Narrativa,Novela
Traducción al francés de: René L.-F. Durand.,214065,"Farabeuf, ou, La chronique d'un instant",1969,Gallimard,,,,,,Du monde entier,París,Francia,Francés,Narrativa,Novela
Traducción al francés de: Gabrielle Cabrini.,214066,Poèmes,1960,Gallimard,,,,,,Folio bilingue,París,Francia,Francés,Poesía,
Traducción al francés de: Alexandra Carrasco.,214068,La petite reine de Bahia,2014,Gallimard,,,,,,Denoël & d'ailleurs,París,Francia,Francés,Narrativa,Novela
Traducción al francés de: Claude Fell.,214070,Le maître du miroir,2001,Gallimard,,,,,,Denoël & d'ailleurs,París,Francia,Francés,Narrativa,Novela
Traducción al francés de: Céline Zins.,214073,Apollon et les putains,2003,Gallimard,,,,,,Folio,París,Francia,Francés,Narrativa,Cuento
,214120,T'es qui là?,1955,Seghers,,,,,,,París,Francia,Francés,Narrativa,Cuento
Traducción al francés de : Claude Fell.,214218,Parade d'amour,1989,Seuil,,,,,,,París,Francia,Francés,Narrativa,Novela
Traducción al inglés de: Natasha Wimmer.,214219,Sudden death,2016,Harvill Secker,,,,,,,Londres,Reino Unido,Inglés,Narrativa,Novela
Traducción al inglés de: Brendan Riley.,214220,Hypothermia,2013,Dalkey Archive Press,,,,,,,Champaign,EUA,Inglés,Narrativa,
Traducción al inglés de: David Pasto.,214221,The house of trials,1997,Peter Lang,,,,,,Ibérica,Nueva York,EUA,Inglés,Dramaturgia,
,214222,Sor Juana : her life and her world,1988,Faber,,,,,,,Londres,Reino Unido,Inglés,Ensayo,
Traducción al sueco de: Hanna Axén.,214223,Klagosång över Miguel Pruneda,2006,Boca Pocky,,,,,,,Estocolmo,Suecia,Sueco,Narrativa,Novela
Traducción al sueco de: Hanna Axén.,214224,Den sista läsaren,2009,Atlas,,,,,,,Estocolmo,Suecia,Sueco,Narrativa,Novela
Traducción al francés de: Jacques Bellefroid.,214225,Batailles dans le désert,1998,La différence,,,,,,Littérature étrangère Mexique,París,Francia,Francés,Narrativa,Novela
Traducción al sueco de: Marika Gedin.,214226,Kroppen jag föddes i,2015,Natur och Kultur,,,,,,,Estocolmo,Suecia,Sueco,Narrativa,Novela
Traducción al francés de : Delphine Valentin.,214227,Pétales et autres histoires embarrassantes,2009,Actes Sud,,,,,,Lettres latino-américaines,Arles,Francia,Francés,Narrativa,Cuento
Traducción al sueco de: Jan Sjögren.,214228,Gryning över avgrunden,1956,Arbetarkultur,,,,,,,Estocolmo,Suecia,Sueco,Narrativa,Novela
Traducción al inglés de: Martín Camps.,214276,Rainbows at Seven Eleven,2016,Universidad Autónoma de Zacatecas,Ediciones y Gráficos Eón,,,,,Narrativa,D.F.,México,Inglés,Narrativa,Novela
,214290,A rainha do cine Roma,2010,LeYa,,,,,,,X,Brasil,Portugués,Narrativa,Novela
Traducción al portugués de: Amir Cadôr.,214299,A nova arte de fazer livros,2011,C,Arte,,,,,,Belo Horizonte,Brasil,Portugués,Crítica y estudios sobre géneros varios,
Traducción al francés de: Jean-Claude Masson.,214301,Lueurs de l'Inde,1997,Gallimard,,,,,,Arcades,París,Francia,Francés,Ensayo,
Traducción al francés de: Jean-Claude Masson.,214302,L'autre voix. Poésie et fin du siècle,1992,Gallimard,,,,,,Arcades,París,Francia,Francés,Crítica y estudios sobre géneros varios,
Traducción al francés de: Jean-Clarence Lambert.,214304,Liberté sur parole,1990,Gallimard,,,,,,Du monde entier,París,Francia,Francés,Poesía,
Traducción al francés de: Jean-Claude Masson.,214305,L'Arbre parle,1990,Gallimard,,,,,,Du monde entier,París,Francia,Francés,Poesía,
Traducción al francés de: Jean-Clarence Lambert.,214306,Le labyrinthe de la solitude suivi de Critique de la pyramide,1990,Gallimard,,,,,,Essais,París,Francia,Francés,Ensayo,
Traducción al francés de: Roger Caillois.,214309,Mise au net,1977,Gallimard,,,,,,Du monde entier,París,Francia,Francés,Poesía,
Traducción al francés de: Claude Esteban.,214312,Le feu de chaque jour,1986,Gallimard,,,,,,Du monde entier,París,Francia,Francés,Poesía,
Traducción al francés de: Jean-Claude Masson.,214314,Une planète et quatre ou cinq mondes. Réflexions sur l'histoire contemporaine,1985,Gallimard,,,,,,Folio essais,París,Francia,Francés,Ensayo,
Traducción al francés de: Jean-Claude Masson.,214316,Le signe et le grimoire. Essais sur l'art mexicain,1995,Gallimard,,,,,,Art et artistes,París,Francia,Francés,Ensayo,
Traducción al francés de: André Pieyre de Mandiargues.,214321,La fille de Rappaccini,1972,Gallimard,,,,,,Théâtre,París,Francia,Francés,Dramaturgia,
Traducción al francés de: Yesé Amory.,214322,Figures et figurations,2000,Gallimard,,,,,,,París,Francia,Francés,Poesía,
,214391,Origène: nouvelle mexicaine,1901,L. Vanier,,,,,,,París,Francia,Francés,Narrativa,Novela
Traducción al francés de: Aleksandar Grujicic.,214397,Oasis dans le Pacifique,2009,T. Magnier,,,,,,,París,Francia,Francés,Narrativa,Novela
Traducción al francés de: David Ferré.,214398,Hitler dans le cœur,2013,Éditions Le Miroir qui fume,,,,,,Théâtre Contemporain,X,Francia,Francés,Dramaturgia,
Traducción al francés de: David Ferré.,214402,New York versus el zapotito,2013,Éditions Le Miroir qui fume,,,,,,Théâtre Contemporain,X,Francia,Francés,Dramaturgia,
Traducción al francés de: Philippe Eustachon.,214410,Moi aussi je veux un prophète,2006,Éditions Le Miroir qui fume,,,,,,Théâtre Contemporain,X,Francia,Francés,Dramaturgia,
Traducción al francés de: Jacques Aubergy.,214411,"Je paie pas le loyer, je fais la grève!",2008,,,,,,,,Marsella,Francia,Francés,Narrativa,
,214413,68,2008,,,,,,,,Montreuil,Francia,Francés,Obras biográficas,"Biografías, autobiografías y memorias"
Traducción al francés de: Claude Bleton.,214415,Pancho Villa: roman d'une vie,2009,Payot et Rivages,,,,,,,París,Francia,Francés,Obras biográficas,"Biografías, autobiografías y memorias"
,214416,Andrómaca Real. Électre se réveille,2011,Éditions Le Miroir qui fume,,,,,,Théâtre Contemporain,X,Francia,Francés,Dramaturgia,
Traducción al francés de: René Solís Brun.,214417,D'amour et de fantômes,2005,Payot et Rivages,,,,,,,París,Francia,Francés,Narrativa,Cuento
Traducción al francés de: René Solis.,214477,Le rendez-vous des héros,1996,Payot et Rivages,,,,,,Bibliothèque étrangère,París,Francia,Francés,Narrativa,Novela
Traducción al francés de: René Solis.,214480,Ombre de l'ombre,1992,Payot et Rivages,,,,,,Rivages/Noir,París,Francia,Francés,Narrativa,Novela
Traducción al francés de: Juan Marey.,214484,La vie même,1992,Payot et Rivages,,,,,,Rivages/Noir,París,Francia,Francés,Narrativa,Novela
Traducción al francés de: René Solis.,214485,Cosa facil,1994,Payot et Rivages,,,,,,Rivages/Noir,París,Francia,Francés,Narrativa,Novela
Traducción al francés de: René Solis.,214487,Quelques nuages,1994,Payot et Rivages,,,,,,Rivages/Noir,París,Francia,Francés,Narrativa,Novela
Traducción al francés de: René Solis.,214488,À quatre mains,1995,Payot et Rivages,,,,,,Rivages/Noir,París,Francia,Francés,Narrativa,Novela
Traducción al francés de: Marianne Millon.,214491,Pas de fin heureuse,1997,Payot et Rivages,,,,,,Rivages/Noir,París,Francia,Francés,Narrativa,Novela
Traducción al francés de: Marianne Millon.,214492,Même ville sous la pluie,1998,Payot et Rivages,,,,,,Rivages/Noir,París,Francia,Francés,Narrativa,Novela
Traducción al francés de: Anne Masè.,214493,La bicyclette de Léonard,1998,Payot et Rivages,,,,,,Rivages/Noir,París,Francia,Francés,Narrativa,Novela
Traducción al francés de: Marianne Millon.,214494,Jours de combat,2000,Payot et Rivages,,,,,,Rivages/Noir,París,Francia,Francés,Narrativa,Novela
Traducción al francés de: René Solis.,214495,Rêves de frontière,2002,Payot et Rivages,,,,,,Rivages/Noir,París,Francia,Francés,Narrativa,Novela
Traducción al francés de: René Solis.,214496,Le trésor fantôme,2003,Payot et Rivages,,,,,,Rivages/Noir,París,Francia,Francés,Narrativa,Novela
Traducción al francés de: René Solis.,214497,Nous revenons comme des ombres,2004,Payot et Rivages,,,,,,Rivages/Noir,París,Francia,Francés,Narrativa,Novela
Traducción al francés de: René Solis.,214498,Adiós Madrid,2005,Payot et Rivages,,,,,,Rivages/Noir,París,Francia,Francés,Narrativa,Novela
Traducción al francés de: René Solis.,214499,Des morts qui dérangent,2008,Payot et Rivages,,,,,,Rivages/Noir,París,Francia,Francés,Narrativa,Novela
Traducción al francés de: René Solis.,214500,Défunts disparus,2010,Payot et Rivages,,,,,,Rivages/Noir,París,Francia,Francés,Narrativa,Novela
,214501,"Ernesto Guevara, connu aussi comme le Che. Tome I",2001,Payot et Rivages,,,,,,Petite Bibliothèque Payot,París,Francia,Francés,Obras biográficas,"Biografías, autobiografías y memorias"
,214502,"Ernesto Guevara, connu aussi comme le Che. Tome II",2001,Payot et Rivages,,,,,,Petite Bibliothèque Payot,París,Francia,Francés,Obras biográficas,"Biografías, autobiografías y memorias"
Traducción al francés de: Gabriel Iaculli.,214503,Les lèvres de l'eau,1999,Éditions du Rocher,,,,,,Motifs,París,Francia,Francés,Narrativa,Novela
Traducción al francés de: Gabriel Iaculli.,214504,La peau de la terre,2010,Éditions du Rocher,,,,,,Motifs,París,Francia,Francés,Narrativa,Novela
Traducción al francés de: Gabriel Iaculli.,214505,Les visages de l'air,2010,Éditions du Rocher,,,,,,Motifs,París,Francia,Francés,Narrativa,Novela
Traducción al francés de: Gabriel Iaculli. Traducción al francés de: Gabriel Iaculli.,214506,Neuf fois neuf choses que l'on dit de Mogador,2006,Allusifs,,,,,,Les allusifs LI,Montreal,Canadá,Francés,Narrativa,Novela
Traducción al Otomí de: Petra Benítez.,214507,La palabra azul = Hña k’angi ngu ra m’etsi,2011,Consejo Editorial de la Administración Pública Estatal,Secretaría de Educación del Estado de México,Biblioteca Mexiquense del Bicentenario,,,,Lecturas de Cabecera,Toluca,México,otomí,Poesía,
Traducción al portugués de: Joana Angélica d'Avila Melo.,214547,Um doce aroma de morte,2008,Gryphus,,,,,,,Río de Janeiro,Brasil,Portugués,Narrativa,Novela
,214551,O esquadrão guilhotina,2008,Gryphus,,,,,,,Río de Janeiro,Brasil,Portugués,Narrativa,Novela
Traducción al portugués de: Isa Laxe.,214557,Retorno 201,2010,Gryphus,,,,,,,Río de Janeiro,Brasil,Portugués,Narrativa,Cuento
Traducción al francés de: Christilla Vasserot.,214584,"Bêtes, chiennes et autres créatures",2005,Éditions Le Miroir qui fume,,,,,,Théâtre Contemporain,X,Francia,Francés,Dramaturgia,
Traducción al portugués de: J.R. Penteado.,214587,A pior senhora do mundo,2016,SESI-SP,,,,,,Quem lê Sabe Por quê,São Paulo,Brasil,Portugués,Narrativa,Cuento
Traducción al francés de: David Ferré.,214590,Essai sur les gens fragiles,2014,Éditions Le Miroir qui fume,,,,,,Théâtre Contemporain,París,Francia,Francés,Dramaturgia,
Traducción al portugués de: J.R. Penteado.,214593,Folha de papel,2016,SESI-SP,,,,,,Quem lê Sabe Por quê,São Paulo,Brasil,Portugués,Narrativa,Cuento
,214598,Anatomie de la gastrite,2013,Éditions Le Miroir qui fume,,,,,,Théâtre Contemporain,X,Francia,Francés,Dramaturgia,
,214601,Face à quelques sphynx,2010,Éditions Le Miroir qui fume,,,,,,Théâtre mexican du XXe siècle,X,Francia,Francés,Dramaturgia,
Traducción al francés de: Gabriel Iaculli.,214605,Comment la mélancolie est arrivée à Mogador,1999,Éditions du Rocher,,,,,,Nouvelle,París,Francia,Francés,Narrativa,Novela
Traducción al francés de: Cédric Demangeot.,214606,Les démons de la langue,1999,Fata Morgana,,,,,,Archipels,Saint-Clément-de-Rivière,Francia,Francés,Narrativa,Cuento
Traducción al francés de: Gabriel Iaculli.,214608,L'atelier du temps,2004,Plon,,,,,,,París,Francia,Francés,Narrativa,Novela
Traducción al francés de: Gabriel Iaculli.,214610,Nocturne de Boukhara: nouvelles,2007,Les Allusifs,,,,,,Roman à rabat,Montreal,Canadá,Francés,Narrativa,Cuento
Traducción al francés de: Gabriel Iaculli.,214612,Le temps des cendres,2009,Points,,,,,,,París,Francia,Francés,Narrativa,Novela
Traducción al francés de: Gabriel Iaculli.,214614,Le jardin dévasté,2009,Seuil,,,,,,Cadre vert,París,Francia,Francés,Narrativa,Novela
Traducción al francés de: Gabriel Iaculli.,214616,La fin de la folie,2010,Points,,,,,,,París,Francia,Francés,Narrativa,Novela
Traducción al francés de: Gabriel Iaculli.,214617,À la recherche de Klingsor,2008,Points,,,,,,,París,Francia,Francés,Narrativa,Novela
Traducción al francés de: Gabriel Iaculli.,214619,Les bandits : opéra bouffe en trois actes,2016,Points,,,,,,,París,Francia,Francés,Narrativa,Novela
